doc_code,t1,t2,t3,c1,c2,c3,c4,title,content,image,table,appendix,math_exp,attachment,reference,enclosure_image,enclosure,asterisk,appendix_table
C-59-2022,7.,7.1,,,,,,건물주의 역할,"소유하거나, 건물의 관리를 책임지는 자는 지붕작업 시 다음 사항을 고려해야 한다. 건물의 설계와 특성을 고려하여 지붕 교체에 따른 설계 감독자와 계약자를 지명하며, 긴급히 지붕 수리를 하도록 작업자에게 지시를 할 경우에는 작업자가 안전하게 작업을 수행할 수 있도록 아래 사항을 포함한 관련 정보를 반드시 제공하여야 한다.",,,,,,,,,,
C-59-2022,7.,7.1,,(1),,,,,지붕의 재질,,,,,,,,,,
C-59-2022,7.,7.1,,(2),,,,,지붕의 완공 시기,,,,,,,,,,
C-59-2022,7.,7.1,,(3),,,,,지붕 완공 후 보수 여부,,,,,,,,,,
C-59-2022,7.,7.1,,(4),,,,,지붕 접근로,,,,,,,,,,
C-59-2022,7.,7.1,,(5),,,,,크레인 사용을 위한 공간,,,,,,,,,,
C-59-2022,7.,7.1,,(6),,,,,화재 예방조치,,,,,,,,,,
C-59-2022,7.,7.1,,(7),,,,,접근이 금지되는 지역,,,,,,,,,,
C-59-2022,7.,7.2,,,,,,설계자의 역할,"전문적 기술과 경험을 바탕으로, 위험요소를 제거하고 방지책을 마련하여 계약자로 하여금 지붕 위 안전작업을 제공하는데 도움이 되도록 하여야 한다. 따라서 설계자는 설계 시 초기 건설작업 뿐만 아니라 건물 완공 후 유지·보수에도 대비하여 우선적으로 고려해야 할 사항은 다음과 같다.",,,,,,,,,,
C-59-2022,7.,7.2,,(1),,,,,취약한 재질의 지붕재료 제거,,,,,,,,,,
C-59-2022,7.,7.2,,(2),,,,,건설 중 높은 위치에서의 작업 필요성 최소화,,,,,,,,,,
C-59-2022,7.,7.2,,(3),,,,,완성된 지붕구조에 대한 검사와 유지에 따른 요구사항 최소화,,,,,,,,,,
C-59-2022,7.,7.2,,(4),,,,,"유지·관리를 위한 안전 접근 및 작업장소 확인 및 설계, 대안적 안전 접근법모색",,,,,,,,,,
C-59-2022,7.,7.2,,(5),,,,,지붕 조명의 위치,,,,,,,,,,
C-59-2022,7.,7.2,,(6),,,,,건강과 안전을 고려한 건설 및 유지 관련 정보 제공,,,,,,,,,,
C-59-2022,7.,7.3,,,,,,작업 감독자의 역할,감독자는 실제 작업상의 안전기준을 마련하고 그것이 원활히 이행될 수 있도록 하여야 할 사항은 다음과 같다.,,,,,,,,,,
C-59-2022,7.,7.3,,(1),,,,,모든 작업 프로그램이 충분한 시간을 갖고 안전하게 시행되도록 건물주 및 설계자와 수시로 협의한다.,,,,,,,,,,
C-59-2022,7.,7.3,,(2),,,,,방법 및 설계상의 문제를 해결할 시간을 마련한다.,,,,,,,,,,
C-59-2022,7.,7.3,,(3),,,,,작업 시 지붕 아래 지역의 접근 통제와 낙하물질에 의한 위험요소 제거 등에 관한 작업 프로그램을 마련한다.,,,,,,,,,,
C-59-2022,7.,7.3,,(4),,,,,건물주 및 설계자에게 작업 실행과 관련된 정보를 제공하도록 한다.,,,,,,,,,,
C-59-2022,7.,7.3,,(5),,,,,작업과 관련한 안전방법에 대한 문서를 준비한다.,,,,,,,,,,
C-59-2022,7.,7.3,,(6),,,,,작업자들이 수작업을 안전하게 할 수 있도록 한다.,,,,,,,,,,
C-59-2022,7.,7.3,,(7),,,,,작업 실행 중에 건물주 및 설계자와 협의하여 작업자의 건강을 보장할 수 있는 안전계획이 잘 이행되도록 한다.,,,,,,,,,,
C-59-2022,7.,7.4,,,,,,지붕 작업자 교육훈련,"안전작업을 위해 지붕작업 유형별 사고사례, 사용하는 작업장비의 기능과 사용법 숙지, 개인 보호구 사용방법 및 안전한 작업절차 등에 대한 적절한 지식, 기술 그리고 경험이 필요하고 관련한 교육훈련을 받아야 한다. 그렇지 않다면 그러한 자질을 가진 자의 감독을 받을 필요가 있다.",,,,,,"[참고 1], [참고 2]",,,,
C-56-2017,4.,,,,,,,사전조사,,,,,,,,,,,
C-56-2017,4.,4.1,,,,,,대상 구조물 조사,수립에 앞서 대상 구조물에 대하여 다음과 같은 조치를 하여야 한다.,,,,,,,,,,
C-56-2017,4.,4.1,,(1),,,,,"설계도서 등을 검토하여 구조형식, 기초형식, 면적, 층고, 내·외장재, 평면 및 입면 형상의 특징 등 대상구조물의 개요를 파악하여야 한다.",,,,,,,,,,
C-56-2017,4.,4.1,,(2),,,,,"증·개축의 유·무, 노후화 정도, 피해의 유·무 등 대상구조물의 이력을 조사하여야 한다.",,,,,,,,,,
C-56-2017,4.,4.1,,(3),,,,,"대상 구조물의 압축강도, 인장강도, 부착강도 등 성능과 중성화 및 부식정도 등을 파악하여야 한다.",,,,,,,,,,
C-56-2017,4.,4.1,,(4),,,,,"대상구조물에 발생한 균열, 부등침하, 변형 및 변위의 유·무 등을 조사하여야 한다.",,,,,,,,,,
C-56-2017,4.,4.2,,,,,,부대사항 조사,작업계획서 작성 전 부지상황 및 환경조사 등 다음과 같은 조치를 하여야 한다.,,,,,,,,,,
C-56-2017,4.,4.2,,(1),,,,,"인접구조물, 지반의 종류, 지하수상태, 수목 등 부지 및 주변 환경을 조사하여야 한다.",,,,,,,,,,
C-56-2017,4.,4.2,,(2),,,,,"기계 또는 장비의 작업계획, 자재 및 부재의 야적 및 운반계획, 폐기물의 운반 및 반출계획 가설도로 등을 조사하여야 한다.",,,,,,,,,,
C-56-2017,4.,4.2,,(3),,,,,"공사현장 및 주변 지하매설물(상하수도, 가스관, 전기·전화선, 가공고압선 등) 등의 유·무를 조사하여야 한다.",,,,,,,,,,
C-56-2017,4.,4.2,,(4),,,,,"소음, 진동, 분진 등의 공해에 대한 발생여부와 그 영향권을 조사하여야 한다.",,,,,,,,,,
C-56-2017,5.,,,,,,,리모델링 작업별 안전 준수사항,,,,,,,,,,,
C-56-2017,5.,5.1,,,,,,해체작업,공통사항,,,,,,,,,,
C-56-2017,5.,5.1,,(1),,,,,해체작업 시 다음 사항이 포함된 작업계획서를 작성하여야 한다.,,,,,,,,,,
C-56-2017,5.,5.1,,(1),(가),,,,해체방법 및 해체순서 도면,,,,,,,,,,
C-56-2017,5.,5.1,,(1),(나),,,,"가설설비, 방호설비, 환기설비, 살수설비 및 방화설비 등의 설치방법",,,,,,,,,,
C-56-2017,5.,5.1,,(1),(다),,,,사업장내 연락방법,,,,,,,,,,
C-56-2017,5.,5.1,,(1),(라),,,,해체물의 처리계획,,,,,,,,,,
C-56-2017,5.,5.1,,(1),(마),,,,해체작업용 기계·기구 등의 작업계획,,,,,,,,,,
C-56-2017,5.,5.1,,(1),(바),,,,기타 안전·보건에 관련된 사항,,,,,,,,,,
C-56-2017,5.,5.1,,(2),,,,,"소음, 진동, 분진에 의한 재해가 발생하지 않도록 해체작업현장 주변에 방음막, 방진막, 살수설비 등을 설치하여야 한다.",,,,,,,,,,
C-56-2017,5.,5.1,,(3),,,,,"해체작업현장과 사무실 간의 연락, 해체작업중의 신호 등을 위하여 연락설비를 설치하고 신호수를 배치한 후 위험구역 내에 공사관계자 및 외부인의 출입을 금지하여야 한다.",,,,,,,,,,
C-56-2017,5.,5.1,,(4),,,,,"리모델링 대상구조물에서 부분적으로 슬래브, 보, 기둥, 벽체 등의 부재를 해체할 때에는 구조기술사의 구조검토를 실시하고 부재신설공법 등 보강공법을 적용하여 구조물의 붕괴재해를 예방하여야 한다.",,,,,,,,,,
C-56-2017,5.,5.1,,(5),,,,,"해체된 잔재물은 비계, 작업발판 등에 적재하중을 초과하여 적재하는 것을 금지하고 리프트, 승강기 등 양중기를 사용하여 지상으로 반출하여야 한다.",,,,,,,,,,
C-56-2017,5.,5.1,,(6),,,,,"구조물의 해체작업에 의한 개구부 발생시 덮개, 안전난간, 안전방망 등 안전시설을 설치하고 안전모, 안전화, 안전대 등 보호구를 착용하여야 한다.",,,,,,,,,,
C-56-2017,5.,5.1,,(7),,,,,"사전조사 사항을 근거로 하여 공사기간, 시공성, 안전성, 경제성, 공해 등에 대한 법적 규제 및 주변현황 등을 충분히 검토한 후 적절한 해체공법을 선정하여야 한다., 해체공법에 따른 안전사항",,,,,,,,,,
C-56-2017,5.,5.1,,(1),,,,,강구공법에 의한 해체작업 시 강구가 크레인으로부터 이탈하지 않도록 접속부위 및 와이어로프의 상태를 수시로 점검하여야 한다.,,,,,,,,,,
C-56-2017,5.,5.1,,(2),,,,,"브레이커 공법에 의한 해체작업 시 파편이 비산하지 않도록 주의하고 소음, 진동에 의한 소음성 난청, 진동장해 등의 재해를 예방하기 위하여 귀마개, 방진장갑 등 보호구를 착용하여야 한다.",,,,,,,,,,
C-56-2017,5.,5.1,,(3),,,,,"해체작업에 사용되는 강구, 브레이커 등의 기계․기구를 양중 할 때에는 낙하․비래의 위험이 없도록 예방조치를 하여야 한다.",,,,,,,,,,
C-56-2017,5.,5.1,,(4),,,,,절단톱 공법에 의한 해체작업 시 톱날 주위에는 접촉방지 커버(Cover)를 설치하고 급·배수설비의 배선상태를 점검하여 감전재해를 예방하여야 한다.,,,,,,,,,,
C-56-2017,5.,5.1,,(5),,,,,"전도공법에 의한 해체작업 시 벽체, 기둥 등 해체부재의 전도위치와 파편의 비산 거리 등을 검토하여 위험구역을 설정하고 강관비계, 철골 등으로 가설 방호벽을 설치하여야 한다.",,,,,,,,,,
C-56-2017,5.,5.1,,(6),,,,,"압쇄공법에 의한 해체작업 시 파워쇼벨에 적합한 중량의 압쇄기를 부착하고 핀, 볼트 등 연결구조부의 접속 상태를 수시로 점검하여야 한다.",,,,,,,,,,
C-56-2017,5.,5.1,,(7),,,,,"워터제트공법 및 레이저공법에 의한 해체작업 시 분출되는 분사수, 레이저 광선 등에 접촉되지 않도록 보호커버를 설치하여야 한다., 석면해체 안전사항",,,,,,,,,,
C-56-2017,5.,5.1,,(1),,,,,"석면이 함유된 건축물이나 설비를 해체할 때에는 근로자의 건강장해를 예방하기 위하여 작업절차, 작업방법, 근로자 보호조치 등이 포함된 석면해체 작업계획서를 작성하여야 한다.",,,,,,,,,,
C-56-2017,5.,5.1,,(2),,,,,"작업장소를 밀폐시킨 후 습식작업, 음압(陰壓)상태 유지 등 석면분진이 흩날리지 않도록 조치 후 작업하여야 한다.",,,,,,,,,,
C-56-2017,5.,5.1,,(3),,,,,"석면해체 작업장은 노출기준인 0.1 개/㎤ 이하로 관리하고 근로자는 방진마스크, 보호의 등의 보호구를 착용하여야 한다.",,,,,,,,,,
C-56-2017,5.,5.1,,(4),,,,,"석면이 함유된 폐기물은 불침투성 용기 또는 자루에 넣어 밀봉한 후 처리하여야 한다., 기타 해체공사 안전작업에 관한 사항은 KOSHA GUIDE C-47-2017(해체공사 안전보건작업 기술지침)의 규정에 따른다.",,,,,,,,,,
C-56-2017,5.,5.2,,,,,,보수․보강작업 안전준수 사항,공통사항,,,,,,,,,,
C-56-2017,5.,5.2,,(1),,,,,"비계조립 등의 방법에 의하여 작업발판, 안전난간, 승강설비 등 안전시설을 설치하고 안전모, 안전화, 안전대 등 보호구를 착용하여야 한다.",,,,,,,,,,
C-56-2017,5.,5.2,,(2),,,,,"기타 보수·보강작업 시 비계와 관련한 안전·보건조치 사항은 KOSHA GUIDE C-20-2015(비계 안전설계 지침), KOSHA GUIDE C-30-2011(강관비계 설치 및 사용 안전 지침), KOSHA GUIDE C-32-2011(시스템비계 안전작업 지침), KOSHA GUIDE C-28-2011(이동식비계 구조기준 및 사용 지침), KOSHA GUIDE C-33-2016(달비계 안전작업 지침)등의 기준에 따른다.",,,,,,,,,,
C-56-2017,5.,5.2,,(3),,,,,"철근, 철골, 목재 등의 자재는 낙하·비래를 예방하기 위하여 2 점 이상 지지하여 양중 시 이탈되어 낙하되지 않도록 하고, 단척 자재·부재인 경우 전용 운반구를 사용하여 양중하여야 한다. 또한 신호수를 배치하여 위험구역 내에 근로자의 출입을 금지시켜야 한다., 보수·보강공법에 따른 안전사항",,,,,,,,,,
C-56-2017,5.,5.2,,(1),,,,,"충전·충진공법, 단면복구공법 등의 보수작업 시 그라인더, 절단기 등 전동기계·기구의 회전체 주위에는 보호커버를 설치하고 보안경, 방진마스크 등 보호구를 착용하여야 한다.",<그림 2>,,,,,,,,,
C-56-2017,5.,5.2,,(2),,,,,"부재신설공법에 의한 보강작업 시 기존 구조물과의 일체화를 위하여 앵커용 볼트, 철근을 견고히 설치하고 모르타르, 에폭시 등에 의한 그라우팅을 밀실하게 하여야 한다.",<그림 3>,,,,,,,,,
C-56-2017,5.,5.2,,(3),,,,,단면증대공법에 의한 보강작업 시 거푸집동바리에 대한 구조검토를 실시하고 기존 구조물과의 부착력을 높이기 위하여 다웰 바(Dowel Bar) 및 보강철근을 설치하여야 한다.,<그림 4>,,,,,,,,,
C-56-2017,5.,5.2,,(4),,,,,"탄소섬유시트, 강판 부착공법 등의 보강작업 시 구조물의 습기 제거, 평활도 유지, 코너부위 곡면처리, 에폭시 그라우팅 등의 방법으로 기존 구조물과의 부착력을 증가시키고 비파괴검사에 의하여 기존 구조물의 손상여부를 조사하여야 한다.",<그림 5>,,,,,,,,,
C-56-2017,5.,5.2,,(5),,,,,"프리스트레스공법에 의한 보강작업 시 사용강선의 규격, 보강대상 부재의 종류, 크리프(Creep)계수, 응력이완 등에 대하여 구조기술사의 구조검토를 실시하고 적정한 초기장력을 결정함으로써 과도한 응력에 의한 구조물의 변형, 균열 등이 발생되지 않도록 작업하여야 한다.","<그림 6>, <그림 7>",,,,,,,,,
C-56-2017,5.,5.2,,(6),,,,,"언더피닝(기초 및 내진보강 등) 작업 시 인접구조물, 지반, 지하수, 지하매설물 등을 조사하고, 관련 기계를 설치할 경우 지반은 평탄하고 견고하게 설치하여야 한다. 또한 소음, 분진, 진동 등 건설공해를 최소화 하기 위하여 방음막, 방진막, 살수설비 등을 설치하여야 한다.",,,,,,,,,,
C-56-2017,5.,5.3.,,,,,,인테리어 및 외장작업 안전 준수사항,,,,,,,,,,,
C-56-2017,5.,5.3.,,(1),,,,,"시멘트, 벽돌, 석고보드 등의 자재는 가급적 지게차로 안전하게 운반하고 적재물의 상부에 올라가서 포장재를 제거하는 등의 불안전 행동을 금지하여야 한다.",,,,,,,,,,
C-56-2017,5.,5.3.,,(2),,,,,"프라이머(Primer), 본드(Bond), 신나 등 인화성 물질을 사용할 경우에는 용접불꽃, 토치(Torch) 등의 점화원 관리를 철저히 하여야 한다.",,,,,,,,,,
C-56-2017,5.,5.3.,,(3),,,,,목재가공용 둥근톱은 날접촉 예방장치를 설치한 후 사용하고 면장갑을 착용한 채로 작업하는 것을 금지하여야 한다.,,,,,,,,,,
C-56-2017,5.,5.3.,,(4),,,,,"천정, 벽체의 마감작업에 타정총, 타카(Tacker) 등을 사용할 때에는 작업의 편리성을 위하여 안전장치를 해지하는 것을 금지하고 보안경, 귀마개 등의 보호구를 착용하여야 한다.",,,,,,,,,,
C-56-2017,5.,5.3.,,(5),,,,,"타일 절단작업에 그라인더, 핸드커터(Hand cutter)기 등 다른 용도의 전동기계·기구의 사용을 금지하고 타일 전용의 절단기를 사용하여야 한다.",,,,,,,,,,
C-56-2017,5.,5.3.,,(6),,,,,"실내에서 뿜칠에 의한 도장작업 시 적정한 공기상태 유지를 위한 환기설비를 설치하고 보안경, 방진마스크 등의 보호구를 착용하여야 한다.",,,,,,,,,,
C-56-2017,5.,5.3.,,(7),,,,,"작업장소를 이동하기 위하여 이동식사다리를 사용할 때에는 심한 손상, 부식이 없고 발판 폭이 30 cm 이상인 것을 사용하여야 한다. 또한 다리부위에 미끄럼 방지장치를 설치하여 미끄러지거나 넘어지는 것을 방지하여야 한다.",,,,,,,,,,
C-56-2017,5.,5.3.,,(8),,,,,도배작업 등에 말비계를 사용할 때에는 지주부재와 수평면과의 기울기를 75° 이하로 하고 지주부재의 하단부에 미끄럼방지장치를 설치하여야 한다.,,,,,,,,,,
C-56-2017,5.,5.3.,,(9),,,,,"석재, 유리 등 중량물 양중작업 시 적정한 용량의 윈치(Winch)를 사용하고 견고한 구조의 앵커(Anchor)를 설치하여야 한다.",,,,,,,,,,
C-56-2017,5.,5.3.,,(10),,,,,"코킹, 외벽 도장작업 등에 사용되는 달비계의 작업용 로프는 옥상의 견고한 앵커, 구조물 등에 풀리지 않도록 설치하고 별도의 구명줄을 설치하여야 한다. 또한 근로자는 안전대를 구명줄에 설치하고 작업하여야 한다.",,,,,,,,,,
C-56-2017,5.,5.3.,,(11),,,,,"기계식 고소작업대(차량탑재형, 시저형 고소작업대 포함)를 사용할 때에는 작업 투입전에 정기검사증 확인 후 아웃트리거(Outrigger)를 견고하고 평탄한 지반에 설치하고, 작업반경에 따른 정격하중을 준수하여 고소작업대의 전도에 의한 재해를 예방하여야 한다.",,,,,,,,,,
C-56-2017,5.,5.3.,,(12),,,,,"기타 조적작업, 용접작업, 목재가공작업, 타일작업, 도장작업, 도배작업, 중량물 취급작업, 달비계 사용작업, 고소작업대 사용 작업 등 인테리어와 외장작업과 관련된 안전조치 사항은 한국산업안전보건공단 해당 기술지침(KOSHA GUIDE)의 기준에 따른다.",,,,,,,,,,
C-56-2017,6.,,,,,,,기타 안전 준수사항,,,,,,,,,,,
C-56-2017,6.,,,(1),,,,,리모델링 작업 중 주민이 거주할 경우에는 중량물의 낙하·비래에 의한 재해를 예방할 수 있는 안전한 통행로를 확보하고 작업장 주변에 출입금지 구역설정 및 견고한 방호벽을 설치하여야 한다.,,,,,,,,,,
C-56-2017,6.,,,(2),,,,,"크레인, 리프트, 곤돌라, 승강기 등의 양중기는 안전인증 후 정기적으로 안전검사를 실시하여야 하며 유효하게 작동되도록 조치 후 작업하여야 한다.",,,,,,,,,,
C-56-2017,6.,,,(3),,,,,"해체된 잔재물, 건설자재, 건설장비 등 중량물 양중작업에 사용되는 와이어로프, 체인 등은 안전기준에 적합한 것을 사용하고 최대허용하중이 표시된 제품을 사용하여야 한다.",,,,,,,,,,
C-56-2017,6.,,,(4),,,,,강관비계 조립 및 해체작업 시에는 KOSHA GUIDE C-30-2011(강관비계 설치 및 사용안전 지침)의 규정에 따른다.,,,,,,,,,,
C-56-2017,6.,,,(5),,,,,"이동식비계 작업 시 비계의 최상부에는 작업발판 및 안전난간을 설치하고, 비계는 아웃트리거(outrigger)를 설치하는 등 전도방지조치를 하여야 한다. 또한 하단부의 바퀴는 브레이크를 고정시킨 후 작업하여야 한다.",,,,,,,,,,
C-56-2017,6.,,,(6),,,,,"탱크, 맨홀, 피트(Pit) 등 환기가 불량한 장소에서 작업 시 환기설비를 설치하여 적정한 공기상태를 유지하고 송기마스크 등 호흡용 보호구를 착용하여야 한다.",,,,,,,,,,
C-56-2017,6.,,,(7),,,,,"용접 또는 용단작업 시 용접불꽃의 비산에 의한 화재, 화상 등의 재해를 예방하기 위하여 작업장 주위의 인화성 물질을 제거하고 불꽃 비산방지포를 설치하여야 한다. 또한 작업장에 소화기를 비치한 후 소화기 사용법에 대한 안전교육을 실시하여야 한다.",,,,,,,,,,
C-56-2017,6.,,,(8),,,,,"산소, LPG 등 가스통은 전도방지조치 후 사용하고 용기의 온도를 40 도 이하로 유지하여야 한다. 또한 환기가 충분한 장소에 보관하고 화약류 또는 가연성 물질, 화기 등을 취급하는 장소에는 저장 및 사용을 금지하여야 한다.",,,,,,,,,,
C-56-2017,6.,,,(9),,,,,"드릴(Drill), 그라인더 등 전동기계·기구는 누전차단기를 설치하고 접지한 후 사용하여야 한다. 또한 전선은 피복이 잘 벗겨지지 않는 캡타이어 케이블(Cabtyre cable)을 사용하여야 한다.",,,,,,,,,,
C-56-2017,6.,,,(10),,,,,"굴삭기, 로더(Loader), 지게차 등 건설기계는 감김·끼임, 낙하·비래 등의 재해를 예방하기 위하여 헤드가드(Head guard)를 부착한 상태로 작업하여야 한다.",,,,,,,,,,
C-56-2017,6.,,,(11),,,,,"건설자재, 장비, 폐기물 등 중량물을 인력으로 운반할 때에는 아래 <표 1>을 참조하여 작업하여야 한다. 또한 무게중심을 낮추고 대상물에 몸을 밀착하는 등 근골격계 부담작업에 의한 건강장해를 예방하여야 한다.",,<표 1>,,,,,,,,
C-56-2017,6.,,,(12),,,,,"작업발판, 파이프서포트(Pipe support), 이동식비계 등의 가설기자재는 심하게 변형, 손상되지 않고 안전인증기준 등에 적합한 제품을 사용하여야 한다.",,,,,,,,,,
C-56-2017,6.,,,(13),,,,,"기타 크레인, 리프트, 곤돌라, 승강기 등 양중작업과 관련된 안전조치 사항은 이동식 크레인 안전보건작업 지침(KOSHA GUIDE C-69-2012), 트럭 탑재형 크레인(Cargo Crane) 안전보건작업지침(KOSHA GUIDE C-85-2013), 양중기에 관한 일반 지침(KOSHA GUIDE M-162-2013) 등의 기준에 따라 정한다.",,,,,,,,,,
C-57-2017,4.,,,,,,,자재 반입 및 준비작업 시 안전조치 사항,,,,,,,,,,,
C-57-2017,4.,,,(1),,,,,"현장 여건을 고려하여 자재반입, 운반, 적재, 양중, 설치 작업 시 근로자 떨어짐 및 자재 등 낙하물에 의한 맞음 방지계획 등이 포함된 안전 작업계획을 수립하여야 한다.",,,,,,,,,,
C-57-2017,4.,,,(2),,,,,"자재반입은 현장 작업공정을 고려하여 공장에서 순서에 맞게 반입하고, 바닥재 및 벽재 등 용도별로 부재를 적재하여야 한다.",,,,,,,,,,
C-57-2017,4.,,,(3),,,,,"자재반입 시는 적재높이, 적재방법 등을 사전에 검토한 후 반입하고, 반입된 부재가 전도 또는 외력에 의한 충격에 파손되지 않도록 지정된 장소에 적재하여야 한다.",,,,,,,,,,
C-57-2017,4.,,,(4),,,,,반입된 자재의 하역작업은 단위자재별 중량 및 적재상태 등을 고려하여 적절한 하역방법을 선정하여야 한다.,,,,,,,,,,
C-57-2017,4.,,,(5),,,,,하역작업 시에는 신호수를 배치하여 정해진 신호에 따라야 하며 신호는 장비 운전원이 잘 볼 수 있는 곳에서 하여야 한다.,,,,,,,,,,
C-57-2017,4.,,,(6),,,,,석재를 하역하여 다른 장소로 운반할 경우에는 석재의 중량과 형상을 고려하여 운반 방법을 선택하여야 한다.,,,,,,,,,,
C-57-2017,4.,,,(7),,,,,지게차를 이용하여 석재를 하역 할 경우에는 KOSHA GUIDE M-185-2015(지게차의 안전작업에 관한 기술지침)에 따른다.,,,,,,,,,,
C-57-2017,4.,,,(8),,,,,석공사를 위해 비계를 조립하고 작업발판을 설치할 경우에는 KOSHA GUIDE C-30-2011(강관비계 설치 및 사용안전 지침) 및 KOSHA GUIDE C-08-2015(작업발판 설치 및 사용안전 지침)에 따른다.,,,,,,,,,,
C-57-2017,5.,,,,,,,석재 설치 작업 시 안전조치 사항,,,,,,,,,,,
C-57-2017,5.,5.1,,,,,,일반사항,,,,,,,,,,,
C-57-2017,5.,5.1,,(1),,,,,석재 설치 작업 시 위험요인 및 안전대책이 포함된 안전작업계획서를 작성하고 이에 따라 작업하여야 한다.,,,,,,,,,,
C-57-2017,5.,5.1,,(2),,,,,안전작업계획서 수립 시 다음 사항을 검토하여 반영하여야 한다.,,,,,,,,,,
C-57-2017,5.,5.1,,(2),(가),,,,"석재의 형태, 중량, 기상조건, 작업범위 등을 고려한 일정 수립",,,,,,,,,,
C-57-2017,5.,5.1,,(2),(나),,,,"양중장비의 종류, 설치 장소 및 양중방법",,,,,,,,,,
C-57-2017,5.,5.1,,(2),(다),,,,근로자 동원 및 구성,,,,,,,,,,
C-57-2017,5.,5.1,,(2),(라),,,,전·후 작업의 진행 여부,,,,,,,,,,
C-57-2017,5.,5.1,,(2),(마),,,,가설전기 사용에 따른 계획,,,,,,,,,,
C-57-2017,5.,5.1,,(2),(바),,,,석재 설치에 따른 구조적 안전성 검토 여부,,,,,,,,,,
C-57-2017,5.,5.1,,(3),,,,,"설치한 석재의 낙하 등을 예방하기 위해 구조체가 설계기준강도 이상이거나, 바탕면이 시공된 후 1개월 이상 경과한 후 붙이기 작업을 하여야 한다.",,,,,,,,,,
C-57-2017,5.,5.1,,(4),,,,,벽의 최하단에 석재를 설치하기 위해서는 슬래브(Slab) 또는 기초 등이 없는 부분에는 석재붙임 완료 후 영구적으로 침하가 되지 않는 구조의 브라켓(Bracket)이나 기초를 설치해야 한다.,,,,,,,,,,
C-57-2017,5.,5.1,,(5),,,,,"석재 설치 작업 시 떨어짐 재해를 예방하기 위해 안전난간과 승강통로가 확보된 작업발판을 설치하여야 하고, 또한 자재의 낙하에 의한 물체에 맞음 재해를 예방하기 위하여 낙하물 방지망, 수직보호망 및 또는 방호선반의 설치, 출입금지구역의 설정, 보호구의 착용 등 위험을 방지하기 위하여 필요한 조치를 하여야 한다. 이 경우 필요한 조치는 실란트 작업 등 마감작업이 완료 될 때까지 안전한 상태를 유지하여야 한다.",,,,,,,,,,
C-57-2017,5.,5.1,,(6),,,,,크레인을 이용하여 석재를 양중 할 때는 자재가 낙하하지 않도록 석재의 결속 상태를 확인하여야 한다.,,,,,,,,,,
C-57-2017,5.,5.1,,(7),,,,,"리프트를 이용하여 석재를 운반할 경우에는 리프트의 과부하방지장치, 권과방지 장치 등 안전장치의 정상작동 여부를 확인하여야 한다.",,,,,,,,,,
C-57-2017,5.,5.1,,(8),,,,,석재의 현장가공을 위해 전동식 절단기를 사용할 때는 이중 절연구조의 절단기를 사용하여야 한다.,,,,,,,,,,
C-57-2017,5.,5.1,,(9),,,,,이동식 전동기계·기구는 접지를 실시하거나 누전차단기와 결속하여 절연파손에 의한 감전재해를 예방하여야 한다.,,,,,,,,,,
C-57-2017,5.,5.1,,(10),,,,,"현장 석재가공 시 발생하는 소음과 분진으로부터 근로자를 보호하기 위해 귀마개, 방진마스크 등 개인보호구를 착용하도록 하여야 한다.",,,,,,,,,,
C-57-2017,5.,5.1,,(11),,,,,"전동식 윈치를 이용하여 석재를 운반할 경우에는 윈치의 고정지점 등 지지방법의 안전성을 사전에 검토하고, 윈치의 권과방지장치, 과부하방지장치 등 안전장치의 이상 유무를 확인하여야 한다.",,,,,,,,,,
