doc_code,t1,t2,t3,c1,c2,c3,c4,title,content,image,table,appendix,math_exp,attachment,reference,enclosure_image,enclosure,asterisk,appendix_table
C-95-2014,6.,6.6,,,,,,PS 강선 계측 및 관리,,,,,,,,,,,
C-95-2014,6.,6.6,,(1),,,,,계측장소는 설계도면 또는 시공계획서를 표준으로 하되 현장여건과 상황에 따라 감독원의 승인 하에 조정될 수 있다.,,,,,,,,,,
C-95-2014,6.,6.6,,(2),,,,,"계측빈도는 굴착중 주 2회 이상, 굴착완료 후 주 1회 이상을 원칙으로 하고 계측의 중요성, 목적, 공사의 진척정도, 계측 방법 여부 등에 따라 조절될 수 있다. 또한 이상토압의 발견 또는 불안전한 변위 등이 발견된 때에는 그 주기를 단축하고 위험여부를 확인하여야 한다.",,,,,,,,,,
C-95-2014,6.,6.6,,(3),,,,,계측항목별 판단기준을 정하고 위험수위별 대처방안을 사전에 수립하여야 한다.,,,,,,,,,,
C-95-2014,6.,6.6,,(4),,,,,띠장 긴장 공법에서의 계측은 원칙적으로 PS 강선의 변위 계측과 기존 계측 시스템을 병용하여 띠장의 휨 거동을 관리하여야 한다.,,,,,,,,,,
C-95-2014,6.,6.6,,(5),,,,,"버팀보 설치 직후, 띠장 설치 직후에 계측기를 설치하여 초기치를 설정하며 설치 후 선행가압 및 PS 강선 긴장 완료시, 굴착시 등 단계별로 계측치의 변화 데이터를 확보하여야 한다.",,,,,,,,,,
C-95-2014,6.,6.6,,(6),,,,,매회의 계측시마다 전회의 데이터를 지참하여 이상치가 아닌가를 현장에서 파악한다.,,,,,,,,,,
C-95-2014,6.,6.6,,(7),,,,,측정이 종료되면 계측 데이터를 정리하여 측정치의 경향을 파악하여 이상이 있으면 재측정을 실시한다.,<그림 8>,,,,,,,,,
C-95-2014,6.,6.6,,(8),,,,,데이터의 정리는 굴착상태 및 지보시기를 명시하여야 한다.,,,,,,,,,,
C-95-2014,6.,6.6,,(9),,,,,각종 계측결과는 일상의 시공관리를 이용하여 장래공사 계획에 반영할 수 있도록 고려하여 정리하고 그 기록은 보존하여야 한다.,,,,,,,,,,
C-95-2014,6.,6.6,,(10),,,,,계측결과는 정기적으로 보고하여야 하며 현저히 큰 변위 및 응력이 발생할 경우는 즉각 감독관 또는 감리자에게 보고하고 지시를 받아야 한다.,,,,,,,,,,
C-95-2014,6.,6.6,,(11),,,,,계측결과 분석은 토질 및 기초기술사 등의 전문기술자에 의해 종합적으로 분석 평가 되어야 한다.,,,,,,,,,,
C-95-2014,6.,6.6,,(12),,,,,"띠장은 언제나 직선으로 장착되어 있어야 하며, 띠장의 직선성 관리를 별도로 하여야 한다. 단, 띠장이 굴착측 또는 배면측으로 단일곡선으로 휘어져 있는 상태는 바람직한 상태이나, 적절한 허용한계(띠장 길이(L)×0.25％)를 넘어서는 안된다.",,,,,,,,,,
C-95-2014,6.,6.6,,(13),,,,,"띠장의 과다변위, 허용긴장력 초과로 인한 띠장 손상 등의 문제가 발생하여 기존 띠장만으로 대응이 어려운 경우 응급되메우기, 추가 띠장 및 버팀보 설치 등의 대책수립을 마련하여야 한다.",,,,,,,,,,
C-95-2014,6.,6.6,,(14),,,,,"띠장의 길이와 변형량을 고려하여 추가 긴장력을 결정한 후 추가 긴장을 하여야 하며, 추가 긴장력을 포함한 총 긴장력은 설계 긴장력의 1.3배를 넘어서는 안된다.",,,,,,,,,,
C-95-2014,6.,6.6,,(15),,,,,"띠장이 단일곡선으로 휘어진 경우에는 정착장치에 추가 긴장력을 도입하고, S곡선으로 휘어진 경우에는 편심보의 유압잭을 조정하여 띠장의 직선성을 유지 시킨다. 띠장이 직선이 되도록 조정한 뒤, 강선의 긴장 여부를 결정한다.",,,,,,,,,,
C-95-2014,6.,6.7,,,,,,해체 및 공사완료,,,,,,,,,,,
C-95-2014,6.,6.7,,(1),,,,,해체 및 철거는 지반침하와 본 공사에 지장이 없고 주변의 구조물 및 설비 시설 등에 손상이 발생하지 않도록 하여야 한다.,,,,,,,,,,
C-95-2014,6.,6.7,,(2),,,,,"해체 및 철거는 사전에 수립된 해체순서를 준수하며, 구조체 전체의 안정성을 확보할 수 있는 방법으로 하며, 시공하기에 앞서 시공순서, 방법, 사용기계, 공정 등에 대하여 책임기술자와 관리감독자의 승인을 받아야 한다.",,,,,,,,,,
C-95-2014,6.,6.7,,(3),,,,,"띠장의 해체 및 철거는 설치 작업의 역순으로 진행되는데, 구조물공 또는 되메우기공의 진행에 따라 순차적으로 필요 개소부터 시행하여야 한다. 해체는 구조물 벽체 슬래브가 충분히 양생한 이후로 구체 또는 되메우기 토사와 버팀목 등에 의하여 흙막이 벽에 작용하는 하중을 받쳐준 후 시행한다.",,,,,,,,,,
C-95-2014,6.,6.7,,(4),,,,,"띠장이 전체적으로 연결되어 있을 때, 강선의 긴장력 제거는 반드시 책임 기술자의 지휘 아래 순차적으로 진행되어야 한다.",,,,,,,,,,
C-95-2014,6.,6.7,,(5),,,,,해체 및 철거 전후에는 계측을 통하여 변위발생 상태를 확인하여야 한다.,<그림 9>,,,,,,,,,
C-95-2014,7.,,,,,,,기타 안전조치 사항,흙막이 공사에 관한 안전작업은 KOSHA GUIDE C-39-2011 굴착공사 안전작업 지침 및 KOSHA GUIDE C-4-2012 흙막이 공사(엄지말뚝) 및 C-63-2012 흙막이 공사(C.I.P 공법) 안전보건작업 지침의 규정에 따른다.,,,,,,,,,,
C-86-2018,4.,,,,,,,안전보건사고 발생시 제재조치 사항,,,,,,,,,,,
C-86-2018,4.,,,(1),,,,,산업안전보건법 제51조의 2(영업정지의 요청 등)에 의거 안전보건사고 발생시 제재의 대상은 다음과 같다.,,<표_UD 1>,,,,,,,,
C-86-2018,4.,,,(2),,,,,산업안전보건법 제30조 제3항에 의거 산업안전보건관리비를 다른 목적으로 사용한 경우에는 1천만원 이하의 과태료가 부과된다.,,,,,,,,,,
C-86-2018,4.,,,(3),,,,,건설기술진흥법 제62조에 따라 안전관리계획 의무대상임에도 불구하고 미수립한 건설업자 또는 주택건설등록업자는 2년 이하의 징역 또는 2천만원 이하의 벌금이 부과된다.,,,,,,,,,,
C-86-2018,4.,,,(4),,,,,"건설산업기본법 시행령 80조, 국가를 당사자로 하는 계약에 관한 법률 제27조에 의거 안전보건사고 발생시 제재의 내용은 다음과 같다.",,<표_UD 2>,,,,,,,,
C-86-2018,4.,,,(5),,,,,"국가를 당사자로 하는 계약에 관한 법 제27조, 영 제76조에 의거 안전보건 사고 발생시 입찰참가제한은 다음과 같다.",,<표_UD 3>,,,,,,,,
C-86-2018,4.,,,(6),,,,,"건설산업기본법 제82조, 영 제80조에 의거 안전보건사고 발생시 산업안전보 건법에 의한 중재재해를 발생하게 한 건설업체에 대해 고용노동부장관의 요청이 있는 경우에는 6개월 이내의 영업정지가 부여되며 그 기준은 다음과 같다.",,<표_UD 4>,,,,,,,,
C-86-2018,4.,,,(7),,,,,안전보건사고 발생시 건설업체에 가해지는 행정제재 절차는 다음과 같다.,,,,,,,,,,
C-86-2018,4.,,,(7),(가),,,,입찰참가 제한,<그림_UD 1>,,,,,,,,,
C-86-2018,4.,,,(7),(나),,,,영업정지,<그림_UD 2>,,,,,,,,,
C-86-2018,5.,,,,,,,건설공사 단계별 업무 흐름도,,<그림_UD 3>,,,,,,,,,
C-86-2018,5.,5.1,,,,,,"입찰, 계약단계",,,,,,,,,,,
C-86-2018,5.,5.1,,(1),,,,,"사업주는 건설공사 입찰, 계약단계에서 시공과정 중 시공법과 절차에 대한 이해도가 부족하거나 안전보건에 관한 전문성이 부족한 경우에는 건설안전 보건분야 전문가(산업안전지도사, 건설안전기술사 등)의 자문이나 지도를 받아야 한다.",,,,,,,,,,
C-86-2018,5.,5.1,,(2),,,,,"사업주는 해당 건설공사에서 중점적으로 관리해야 할 유해위험요인, 재해발생 원인과 대책을 관련 전문가의 자문 및 유사 건설공사 설계도서에 포함된 안전보건관리문서의 검토를 통하여 사전에 발굴토록 하여야 한다. 사업주가 입찰단계에서 건설안전보건분야 전문가의 도움을 받아 사전에 검토하여야 할 사항은 다음과 같다.",,,,,,,,,,
C-86-2018,5.,5.1,,(2),(가),,,,설계에서 지정한 시공법 및 현장조건이 도면과 일치되는지 여부에 관한 사항,,,,,,,,,,
C-86-2018,5.,5.1,,(2),(나),,,,설계에서 지정한 시공법 및 절차에 의해 발생하는 유해위험요인이 있는지 여부에 관한 사항,,,,,,,,,,
C-86-2018,5.,5.1,,(2),(다),,,,시공단계에서 설치되는 가설 시설물의 안전한 설치 및 해체에 관한 사항,,,,,,,,,,
C-86-2018,5.,5.1,,(2),(라),,,,위험장소에서의 작업을 최소화하기 위해 공장제작 자재의 활용을 적극적으로 고려하여 설계되었는지 여부에 관한 사항,,,,,,,,,,
C-86-2018,5.,5.1,,(2),(마),,,,가급적이면 동일 작업장소에서 시공절차가 중복되지 않고 안전하게 작업이 이루어질 것인지 여부에 관한 사항,,,,,,,,,,
C-86-2018,5.,5.1,,(2),(바),,,,개․보수 공사시 구조물이 안전하도록 설계되었는지 여부에 관한 사항,,,,,,,,,,
C-86-2018,5.,5.1,,(2),(사),,,,"무너짐 재해를 유발할 수 있는 인접건물, 구조물 현황에 관한 사항",,,,,,,,,,
C-86-2018,5.,5.1,,(2),(아),,,,구조물에 부정적 영향을 끼칠 수 있는 지반침하에 관한 사항,,,,,,,,,,
C-86-2018,5.,5.1,,(2),(자),,,,지하 매설물과 지하수 흐름에 관한 사항,,,,,,,,,,
C-86-2018,5.,5.1,,(2),(차),,,,건설현장 내 설비나 장비설치에 관한 사항,,,,,,,,,,
C-86-2018,5.,5.1,,(2),(카),,,,건설현장 내에 석면이나 화학폐기물과 같은 유해물질의 존재여부에 관한 사항,,,,,,,,,,
C-86-2018,5.,5.1,,(2),(타),,,,기타 건설공사중 근로자의 안전보건확보를 위하여 산업안전보건관련 법령 등에서 정하는 내용,,,,,,,,,,
C-86-2018,5.,5.2,,,,,,시공준비단계(착공 등),,,,,,,,,,,
C-86-2018,5.,5.2,,(1),,,,,"사업주는 해당 건설공사의 공사입찰유의서, 공사계약일반조건, 공사계약특수 조건, 계약서, 설계도서, 내역서 등에 포함된 안전보건관리 사항에 대하여 건설안전보건분야 전문가의 도움을 받아 건설안전보건을 고려한 시공조건 등을 검토하여 계약을 발주자와 체결하여야 한다.",,,,,,,,,,
C-86-2018,5.,5.2,,(2),,,,,사업주는 건설현장의 자율적인 재해예방활동을 촉진시키기 위하여 산업안전 보건법상에 명시된 안전보건조직을 구성하여야 한다.,,,,,,,,,,
C-86-2018,5.,5.2,,(2),-,,,,"산업안전보건법 제13조 안전보건관리책임자, 제14조 관리감독자, 제18조 안전보건총괄책임자 등",,,,,,,,,,
C-86-2018,5.,5.2,,(3),,,,,사업주는 산업안전보건법 및 건설업 산업안전보건관리비 계상 및 사용기준 고시의 규정에 의하여 산업안전보건관리비가 적정하게 계상되었는지 여부를 확인하고 산업안전보건관리비 사용계획서를 작성하여야 한다.,,,,,,,,,,
C-86-2018,5.,5.2,,(4),,,,,"사업주는 대상공사인 경우 공사착공 전날까지 고용노동부장관이 지정한 재해예방전문지도기관과 기술지도계약을 체결하고, 안전보건관리책임자로 하여금 지속적이고 일관성 있는 재해예방 기술지도를 받을 수 있도록 조치하여야 한다.",,,,,,,,,,
C-86-2018,5.,5.2,,(5),,,,,사업주는 해당 건설사업이 산업안전보건법 시행규칙 제120조 제2항에 의한 유해·위험방지계획서 작성대상 공사에 포함될 경우에는 해당공사 착공 전일까지 산업안전보건법 시행규칙 제120조 제3항에서 정하는 자격을 갖춘자의 의견을 들은 후 유해․위험방지계획서를 작성하여 한국산업안전보건공단에 제출하여야 한다.,,,,,,,,,,
C-86-2018,5.,5.2,,(6),,,,,"사업주는 건설공사를 착공하기 전에 건설안전보건분야 전문가의 도움을 받아 건설현장 내에서의 각종 작업의 내용 및 시공에 사용하는 각종 기계․기구 등을 조사하여 위험을 수반하는 작업내용을 분석하고 산업안전보건법 등의 법규에 정해져 있는 안전보건기준에 따라 안전보건 작업계획을 수립하고, 건설기술진흥법에 의한 안전관리계획서 작성에 반영하여야 한다.",,,,,,,,,,
C-86-2018,5.,5.2,,(7),,,,,"사업주는 건설공사를 착공하기 전에 공사 수행 중 예기치 못한 돌발적인 사고로 인해 본 공사 목적물, 자재 및 가설공사에 입은 물적손해 및 제3자에 대한 대인·대물 배상책임 손해를 보상할 수 있도록 건설공사보험을 가입하여야 한다.",,,,,,,,,,
C-86-2018,5.,5.3,,,,,,시공단계,,,,,,,,,,,
C-86-2018,5.,5.3,,(1),,,,,"사업주는 안전보건관리책임자로 하여금 건설공사 시공단계에서 발생하는 각종 사안에 대하여 건설안전보건을 고려하여 의사결정을 실시하고, 건설안전 관련법령에서 정한 요건을 준수하여 건설재해예방에 노력하도록 하여야 한다.",,,,,,,,,,
C-86-2018,5.,5.3,,(2),,,,,"사업주는 안전보건관리책임자로 하여금 건설공사 시공단계에서 안전보건관리 참여자의 업무가 제대로 이행되고 있는 지를 총괄하고, 필요한 경우 건설안전보건분야 전문가의 도움을 받아 업무를 수행하도록 하여야 한다.",,,,,,,,,,
C-86-2018,5.,5.3,,(3),,,,,사업주는 안전보건관리책임자로 하여금 산업안전보건법 등 건설안전보건 관련 법규에서 정한 안전보건관리 업무가 제대로 이행될 수 있도록 지원하여야 한다.,,,,,,,,,,
C-86-2018,5.,5.3,,(4),,,,,"사업주는 안전보건관리책임자로 하여금 산업재해 및 건강장해 예방을 위한 산업안전보건관리비를 건설업 산업안전보건관리비 계상 및 사용기준(고용 노동부 고시)에 의거하여 당해 목적에만 사용토록 하고, 안전보건관리 활동 실적에 따른 산업안전보건관리비 집행실적을 관리하도록 하여야 한다. 또한 사업주는 안전보건관리책임자로 하여금 산업안전보건법 제30조 제3항에 따라 해당 공사를 위하여 계상된 산업안전보건관리비를 그가 사용하는 근로자와 그의 수급인이 사용하는 근로자의 산업재해 및 건강장해 예방에 사용하고 그 사용명세서를 작성하고 공사 종료 후 1년간 보존하도록 하여야 한다.",,,,,,,,,,
C-86-2018,5.,5.3,,(5),,,,,사업주는 산업안전보건법 시행규칙 제30조에 따라 도급사업 시의 안전보건 조치 등을 이행하여야 한다.,,,,,,,,,,
C-86-2018,5.,5.3,,(6),,,,,"사업주는 안전보건관리책임자로 하여금 건설안전보건분야 전문가의 도움을 받아 잠재적인 유해·위험요인을 사전에 철저히 분석후 제거 또는 감소시키기 위한 위험성 평가를 사업장 위험성 평가에 관한 지침(제2017-36호, ‘17.7.1)에 의하여 실시하도록 하여야 한다.",,,,,,,,,,
C-86-2018,5.,5.3,,(7),,,,,"사업주는 안전보건관리책임자로 하여금 재해예방전문지도기관이 점검표 (Check List)에 의해 점검하고 의견서를 포함한 보고서를 작성하여 제출하면 점검지적사항을 신속히 보완, 조치토록 지시하고 그 이행여부를 확인하도록 하여야 한다.",,,,,,,,,,
C-86-2018,5.,5.3,,(8),,,,,"사업주는 안전보건관리책임자로 하여금「건설기술진흥법」규정에 의한 거푸집동바리, 굴착 및 흙막이 지보공, 비계 등의 대상시설물에 해당하는 가설구조물 시공상세도 작성시에는 해당분야 전문가의 확인을 받아 안전 보건을 확보하도록 하여야 한다.",,,,,,,,,,
C-86-2018,5.,5.3,,(9),,,,,"사업주는 안전보건관리책임자로 하여금 산업안전보건법 제 31조(안전·보건 교육)에 의거 안전보건교육을 실시하고 안전보건교육의 내용을 기록 및 관리 하도록 하여야 한다. 특히, 건설업 기초안전보건교육은 사업주 의무이므로 교육 소요비용은 사업주가 부담하여야 한다.",,,,,,,,,,
C-86-2018,5.,5.3,,(9),-,,,,"교육실시 결과는 교육내용, 참석자 명단, 교육사진 등과 함께 교육실시 보고서를 작성, 결재, 보관",,,,,,,,,,
C-86-2018,5.,5.3,,(10),,,,,사업주는 안전보건관리책임자로 하여금 건설현장을 순회점검하고 그 내용을 기록․유지하도록 하여야 한다.,,,,,,,,,,
C-86-2018,5.,5.3,,(11),,,,,사업주는 안전보건관리책임자로 하여금 산업안전보건법 시행규칙 제29조 (협의체의 구성 및 운영)에 의거 사업주간 협의체를 운영하도록 하여야 한다.,,,,,,,,,,
C-86-2018,5.,5.3,,(11),(가),,,,정기적으로 사업주간 협의체 회의실시,,,,,,,,,,
C-86-2018,5.,5.3,,(11),(나),,,,"고위험작업에 대한 세부작업계획 발표, 논의",,,,,,,,,,
C-86-2018,5.,5.3,,(11),(다),,,,"안전보건관리책임자, 당사 직원, 협력업체 대표자로 구성(안전보건관리 책임자가 주관)",,,,,,,,,,
C-86-2018,5.,5.3,,(11),(라),,,,"회의 운영 결과를 회의록에 기록, 결재, 보관",,,,,,,,,,
C-86-2018,5.,5.3,,(12),,,,,"사업주는 안전보건관리책임자로 하여금 공사현장의 유해 또는 위험한 시설 및 장소에는 금지, 경고, 지시를 위한 안전표지와 비상시 조치의 안내 및 안전보건의식 고취를 위한 표지를 부착하도록 하여야 한다.",,,,,,,,,,
C-86-2018,5.,5.3,,(13),,,,,"사업주는 안전보건관리책임자로 하여금 근로자를 유해․위험한 작업에 종사시킬 경우에는 적합한 보호구를 지급하고 보호구의 제한적 사용, 보호구의 관리 및 전용 보호구를 지급하도록 하여야 한다.",,,,,,,,,,
C-86-2018,5.,5.3,,(14),,,,,사업주는 안전보건관리책임자로 하여금 산업안전보건법 제43조와 관련하여 다음과 같이 근로자 건강진단을 실시하도록 하여야 한다.,,,,,,,,,,
C-86-2018,5.,5.3,,(14),(가),,,,혈압 등 기초 건강진단은 채용당일 현장에서 간이건강검진실시,,,,,,,,,,
C-86-2018,5.,5.3,,(14),(나),,,,특수 건강진단 대상 작업시 배치전 건강진단 실시,,,,,,,,,,
C-86-2018,5.,5.3,,(15),,,,,사업주는 안전보건관리책임자로 하여금 산업안전보건기준에관한 규칙 제 665조(중량의 표시 등)에 의거 근로자가 5킬로그램 이상의 중량물을 들어 올리는 작업을 하는 경우에 다음 각 호의 조치를 하도록 하여야 한다.,,,,,,,,,,
C-86-2018,5.,5.3,,(15),(가),,,,주로 취급하는 물품에 대하여 근로자가 쉽게 알 수 있도록 물품의 중량과 무게중심에 대하여 작업장 주변에 안내표시를 할 것,,,,,,,,,,
C-86-2018,5.,5.3,,(15),(나),,,,"취급하기 곤란한 물품은 손잡이를 붙이거나 갈고리, 진공빨판 등 적절한 보조도구를 활용할 것",,,,,,,,,,
C-86-2018,5.,5.3,,(16),,,,,사업주는 안전보건관리책임자로 하여금 산업안전보건법 제36조(안전검사)와 관련하여 안전인증을 받은 것을 확인하고 안전검사를 합격한 기계기구를 사용하도록 하여야 한다.,,,,,,,,,,
C-86-2018,5.,5.3,,(17),,,,,사업주는 안전보건관리책임자로 하여금 산업안전보건법 제64조(서류의 보존)에 의하여 안전보건관리문서를 보존하도록 하여야 한다. 또한 사업주는 안전 보건관리책임자로 하여금 향후 유사 건설공사의 안전보건관리에 유용한 정보제공을 위해 해당 건설공사가 준공되면 건설현장에서 작성된 안전보건 관리문서를 본사에 제출·관리하도록 하여야 한다.,,,,,,,,,,
C-86-2018,5.,5.3,,(17),(가),,,,산업재해 발생시 관련서류,,,,,,,,,,
C-86-2018,5.,5.3,,(17),(가),-,,,"사고조사보고서, 요양신청서, 재해분석 및 재발방지대책 수립 서류",,,,,,,,,,
C-86-2018,5.,5.3,,(17),(나),,,,"관리감독자 지정, 직무수행일지 및 교육실시 관련자료",,,,,,,,,,
C-86-2018,5.,5.3,,(17),(나),-,,,"관리감독자 교육일지, 안전보건일지 등",,,,,,,,,,
C-86-2018,5.,5.3,,(17),(다),,,,근로자에 대한 안전보건교육 관련서류,,,,,,,,,,
C-86-2018,5.,5.3,,(17),(다),-,,,"신규채용자교육, 특별안전보건교육, 근로자 정기안전보건교육, 작업내용 변경시교육",,,,,,,,,,
C-86-2018,5.,5.3,,(17),(라),,,,유해위험 기계기구에 대한 안전조치 관련서류,,,,,,,,,,
C-86-2018,5.,5.3,,(17),(라),-,,,작업장 내 유해위험 기계기구 및 설비에 대한 안전장치설치여부,,,,,,,,,,
C-86-2018,5.,5.3,,(17),(라),-,,,,,,,,,,,,,
C-86-2018,5.,5.3,,(17),(라),-,,,,,,,,,,,,,
C-86-2018,5.,5.3,,(17),(라),-,,,,,,,,,,,,,
C-86-2018,5.,5.3,,(17),(마),,,,유해위험 기계기구 및 설비에 대한 안전검사 실시여부(검사필증 등),,,,,,,,,,
C-86-2018,5.,5.3,,(17),(바),,,,작업환경측정 대상사업장의 경우 작업환경 측정결과서류 및 예방계획 자료 등,,,,,,,,,,
C-86-2018,5.,5.3,,(17),(사),,,,물질안전보건자료의 게시 및 경고표지 부착여부,,,,,,,,,,
C-86-2018,5.,5.3,,(17),(아),,,,중량물취급 작업에 따른 작업계획서 작성여부,,,,,,,,,,
C-86-2018,5.,5.3,,(17),(자),,,,산업안전보건관리비 사용실적 내역,,,,,,,,,,
C-86-2018,6.,,,,,,,사고처리 및 응급조치,,,,,,,,,,,
C-86-2018,6.,,,(1),,,,,"사업주는 안전보건관리책임자로 하여금 당해 건설공사 현장에서 안전보건 사고가 발생하였을 경우에는 즉시 필요한 응급조치를 취하고, 본사에 보고하여 긴급조치 및 복구가 이루어질 수 있도록 조치하도록 하여야 한다.",,,,,,,,,,
C-86-2018,6.,,,(1),(가),,,,사고 발생시 적절한 긴급조치,,,,,,,,,,
C-86-2018,6.,,,(1),(나),,,,부상자 및 질병자에 대한 응급조치,,,,,,,,,,
C-86-2018,6.,,,(1),(다),,,,연쇄사고 및 사고확대 방지를 위한 안전보건조치,,,,,,,,,,
C-86-2018,6.,,,(2),,,,,사업주는 안전보건관리책임자로 하여금 신속하게 사고를 처리하도록 하여야 한다.,,,,,,,,,,
C-86-2018,6.,,,(2),(가),,,,현장에서는 사고발생 즉시 관리감독자가 신속히 안전보건관리책임자에게 보고,,,,,,,,,,
C-86-2018,6.,,,(2),(나),,,,"안전보건관리책임자는 사고발생시 빠른 시간 내에 사고내용, 처리결과 및 향후 처리계획 등을 본사에 보고",,,,,,,,,,
C-86-2018,6.,,,(2),(다),,,,"사고조사는 동종사고가 재발되지 않도록 인적, 물적 및 관리적 원인을 분석하고 대책을 수립하여 실시",,,,,,,,,,
C-86-2018,6.,,,(3),,,,,"사업주는 안전보건관리책임자로 하여금 중대재해가 발생한 사실을 알게된 경우에는 산업안전보건법 제10조 제2항에 따라 지체 없이 발생 개요 및 피해 상황, 조치 및 전망, 그 밖의 중요한 사항에 대해 관할 지방고용노동관서의 장에게 전화·팩스, 또는 그 밖에 적절한 방법으로 보고하도록 하여야 한다. 또한, 중대재해 발생시 일반적인 업무 흐름도(예)는 다음과 같다.",<그림 1>,,,,,,,,,
C-86-2018,7.,,,,,,,기타사항,,,,,,,,,,,
C-86-2018,7.,,,(1),,,,,"그 밖의 중소규모 건설업체 본사의 안전보건관리에 관한 사항은 「산업안전 보건법」 같은 법 시행령, 같은 법 시행규칙, 안전보건규칙에서 정하는 바에 따른다.",,,,,,,,,,
C-11-2012,4.,,,,,,,이동 통로 선정 기준,"따른 이동통로의 선정은 통상 다음과 같은 기준을 적용하며, 작업장 특성에 따라 약간의 조정은 가능하다.",,,,,,,,,,
C-11-2012,4.,,,(1),,,,,"경사로는 경사각 30° 이내에서 설치하며, 경사각이 15°를 초과하는 때에는 미끄러지지 않는 구조로 하여야 한다.",,,,,,,,,,
C-11-2012,4.,,,(2),,,,,계단은 경사각 30°에서 60°까지의 구간에서 설치하여야 한다.,,,,,,,,,,
C-11-2012,4.,,,(3),,,,,"사다리는 경사각 60°에서 90°까지 구간에서 설치하며, 이동식 사다리의 기 울기는 75° 이하로 하여야 한다.",,,,,,,,,,
C-11-2012,5.,,,,,,,가설 계단의 설치 기준,계단의 구조는 <그림. 1>와 같으며 아래의 요건을 만족하여야 한다.,<그림 1>,,,,,,,,,
C-11-2012,5.,,,(1),,,,,일반 요건,,,,,,,,,,
C-11-2012,5.,,,(1),(가),,,,"가설 계단의 재료는 한국산업규격 “KS F 8012 작업발판“의 규정에 적합한 것이어야 하며, 다음의 규정에 적합하거나 이와 동등한 이상의 기계적 성질을 가진 것으로 사용하고, 주위 환경에 의해 발생되는 부식에 대해 저항성이 있어야 한다.",,<표_UD 1>,,,,,,,,
C-11-2012,5.,,,(1),(나),,,,계단의 재료는 충분한 강도를 유지하여야 하며 사용 중에 안전성이 있어야 한다.,,,,,,,,,,
C-11-2012,5.,,,(1),(다),,,,"발판을 구멍이 있는 재료로 만들 때에는 렌치, 기타 공구 등이 낙하할 위험이 없는 구조로 하여야 한다.",,,,,,,,,,
C-11-2012,5.,,,(1),(라),,,,"발판은 이동 시의 추락, 전도, 미끄러짐 등으로 인한 재해를 예방할 수 있는 구조로 설치되어야 한다.",,,,,,,,,,
C-11-2012,5.,,,(1),(마),,,,발판 끝부분과 계단참의 표면은 미끄럼방지 조치를 하여야 한다.,,,,,,,,,,
C-11-2012,5.,,,(1),(바),,,,계단 위와 주변에는 통행에 유해한 돌출된 못이나 철선 등이 없어야 한다.,,,,,,,,,,
C-11-2012,5.,,,(1),(사),,,,계단에는 자재나 공구 등을 적재하여서는 안된다.,,,,,,,,,,
C-11-2012,5.,,,(2),,,,,가설 계단의 설계 요건,,,,,,,,,,
