doc_code,t1,t2,t3,c1,c2,c3,c4,title,content,image,table,appendix,math_exp,attachment,reference,enclosure_image,enclosure,asterisk,appendix_table
C-34-2011,6.,,,(2),(가),,,,"파이프받침의 높이가 3.5m 이상일 때에는 2m이내마다 직교방향으로 수평 연결재를 설치하고, 수평방향 10m이내마다 교차가새를 설치하여 좌굴 및 비틀림을 방지하여야 한다.",,,,,,,,,,
C-34-2011,6.,,,(2),(나),,,,경사진 바닥에 파이프받침을 설치할 때에는 하단에 쐐기등을 설치하여 미끄러지지 않도록 유의하여야 한다.,,,,,,,,,,
C-34-2011,6.,,,(2),(다),,,,강재와 강재의 접속부는 클램프등 전용철물을 사용하여 견고하게 고정하여야 한다.,,,,,,,,,,
C-34-2011,6.,,,(3),,,,,강관틀 형식일 경우에는 다음사항을 준수하여야 한다.,,,,,,,,,,
C-34-2011,6.,,,(3),(가),,,,강관틀 밑면에는 잭 베이스를 이용하며 깔판에 견고히 고정하여야 한다.,,,,,,,,,,
C-34-2011,6.,,,(3),(나),,,,첫단을 조립한 후에 수준기로 수평상태를 확인하여 잭 베이스로 수평을 조절하고 다음 단을 조립하여야 한다.,,,,,,,,,,
C-34-2011,6.,,,(3),(다),,,,보 또는 멍에를 상단에 올릴 때에는 상단에 강재단판을 부착하여 보 또는 멍에에 고정시켜야 한다.,,,,,,,,,,
C-34-2011,6.,,,(3),(라),,,,최상층과 5단 이내마다 직교방향으로 수평연결재를 설치하여야 한다,,,,,,,,,,
C-34-2011,6.,,,(4),,,,,조립강주 형식일 경우에는 다음사항을 준수하여야 한다.,,,,,,,,,,
C-34-2011,6.,,,(4),(가),,,,수직부재와 수평부재 사이의 연결부는 전용철물을 이용하여 견고하게 고정하여야 한다.,,,,,,,,,,
C-34-2011,6.,,,(4),(나),,,,조립강주를 조립한 후 수직부재가 지반에서 이격되지 않도록 유의하여야 한다.,,,,,,,,,,
C-34-2011,6.,,,(4),(다),,,,보 또는 멍에를 상단에 올릴 때에는 상단에 강재단판을 부착하여 보 또는 멍에를 고정시켜야 한다.,,,,,,,,,,
C-34-2011,6.,,,(4),(라),,,,설치높이가 4m를 초과할 때에는 4m이내마다 수평연결재를 직교방향으로 설치하여야 한다.,,,,,,,,,,
C-34-2011,6.,,,(5),,,,,보 형식일 경우에는 다음사항을 준수하여야 한다.,,,,,,,,,,
C-34-2011,6.,,,(5),(가),,,,보 설치지점은 콘크리트의 수직하중 및 보의 하중에 견딜 수 있는 견고한 곳 이어야 한다.,,,,,,,,,,
C-34-2011,6.,,,(5),(나),,,,동바리를 설치하기 위한 별도의 지주를 설치할 때에는 지주의 강성․강도를 확보하고 침하를 방지하기 위한 적절한 조치를 하여야 한다.,,,,,,,,,,
C-34-2011,6.,,,(5),(다),,,,보는 정해진 지점 이외의 곳을 지점으로 이용해서는 안된다.,,,,,,,,,,
C-34-2011,6.,,,(5),(라),,,,보의 지점부가 탈락되지 않도록 견고하게 설치하여야 한다.,,,,,,,,,,
C-34-2011,6.,,,(5),(마),,,,보를 설치하기 전에 소정의 높이와 지간을 결정하고 조립도에 따라 정밀하게 조립하여야 한다.,,,,,,,,,,
C-34-2011,6.,,,(5),(바),,,,"크레인 등으로 보를 인양하여 설치할 때에는, 기 설치된 보에 충격을 가하지 않도록 주의하여야 한다.",,,,,,,,,,
C-34-2011,6.,,,(5),(사),,,,보와 보 사이에는 수평연결재를 설치하여 보의 전도를 방지하여야 한다.,,,,,,,,,,
C-34-2011,7.,,,,,,,거푸집 동바리 해체작업,,,,,,,,,,,
C-34-2011,7.,,,,(가),,,,거푸집 동바리의 존치기간은 설계도서에 의하되 콘크리트 압축강도시험 결과 기준치 이상일 경우에 해체 한다.,,,,,,,,,,
C-34-2011,7.,,,,(나),,,,"관리감독자는 거푸집 동바리의 해체시기, 해체순서, 해체방법 등을 결정하고 근로자에게 주지시켜야 한다.",,,,,,,,,,
C-34-2011,7.,,,,(다),,,,"해체작업에 사용되는 가시설물, 기계․기구 등은 작업 전에 이상유무를 점검 하여야 한다.",,,,,,,,,,
C-34-2011,7.,,,,(라),,,,양중기는 사용 전에 안전점검을 실시하고 이상이 발견될 때에는 즉시 정비하고 정비결과 이상이 없는 경우에 한하여 사용하도록 하여야 한다.,,,,,,,,,,
C-34-2011,7.,,,,(마),,,,해체장소 및 주변지역은 출입금지 구역으로 설정하여 관계자 이외의 출입을 금지시켜야 한다.,,,,,,,,,,
C-34-2011,7.,,,,(바),,,,거푸집 동바리 해체작업 순서는 다음과 같이 조립의 역순으로 한다.,,,,,,,,,,
C-34-2011,7.,,,,(바),①,,,"벽체의 경우에는 타이볼트, 가로띠장, 세로띠장, 거푸집 순서로 해체하고 전도위험에 대비하여 작업구간을 정하여 순서에 맞추어 해체하여야 한다.",,,,,,,,,,
C-34-2011,7.,,,,(바),②,,,"슬래브의 경우에는 가새, 수평연결재, 동바리, 멍에, 장선, 거푸집 순서로 해체하고 교축 방향으로는 지간의 중앙 동바리부터 양단 지지부쪽으로 해체 작업을 진행하여야 한다.",,,,,,,,,,
C-34-2011,7.,,,,(사),,,,"해체된 자재는 종류별, 규격별로 구분하고 재사용 가능여부를 판단하여 정리정돈 한다.",,,,,,,,,,
C-34-2011,8.,,,,,,,기타 거푸집 동바리 안전작업 준수사항,CODE C-6-2004 콘크리트공사 표준안전작업지침의 4. 거푸집 및 거푸집동바리 공사에서 정하는 바에 의한다.,,,,,,,,,,
C-35-2011,4.,,,,,,,작업계획 수립시 준수사항,,,,,,,,,,,
C-35-2011,4.,,,(1),,,,,공사현장의 제반 여건과 교량 상부구조물의 형상을 파악하여 이동식 비계의 형식을 선정하여야 한다.,,,,,,,,,,
C-35-2011,4.,,,(2),,,,,이동식 비계는 이동식 비계에 작용하는 하중을 고려하여 안전성 여부를 검토하여야 한다.,,,,,,,,,,
C-35-2011,4.,,,(3),,,,,"이동식 비계의 설치, 이동, 해체작업 단계별 작업방법과 순서, 안전작업 매뉴얼, 근로자와 장비에 대한 안전조치 사항 등이 포함된 작업계획서를 수립하여야 한다.",,,,,,,,,,
C-35-2011,4.,,,(4),,,,,"작업계획서는 이동식 비계작업에 풍부한 경험과 지식을 갖춘 사람이 수립하여야 하며, 공사중에는 계획서의 내용이 제대로 이행되는지의 여부를 정기적으로 확인할 수 있도록 하여야 한다.",,,,,,,,,,
C-35-2011,5.,,,,,,,설치․이동․해체작업 안전조치사항,,,,,,,,,,,
C-35-2011,5.,5.1,,,,,,공통사항,,,,,,,,,,,
C-35-2011,5.,5.1,,(1),,,,,작업시작 전에 관리감독자를 지정하여 작업을 지휘하도록 하여야 한다.,,,,,,,,,,
C-35-2011,5.,5.1,,(2),,,,,"작업장내 고압 송전선로, 전기․통신케이블 등 장애물 현황을 사전에 조사하여 이설하거나 방호시설을 갖추는 등의 안전조치를 하여야 한다.",,,,,,,,,,
C-35-2011,5.,5.1,,(3),,,,,근로자의 건강상태를 작업전에 확인하여 작업배치 적정여부를 결정하여야 한다.,,,,,,,,,,
C-35-2011,5.,5.1,,(4),,,,,"안전모, 안전대 등 근로자의 개인보호구를 점검하고 작업전에 보호구의 착용 방법에 대한 교육을 실시한 다음 작업중에 착용여부 및 상태를 확인하여야 한다.",,,,,,,,,,
C-35-2011,5.,5.1,,(5),,,,,사용예정 장비는 안전점검을 실시하여 이상이 발견된 때에는 정상적인 장비로 교체하거나 정비하여 이상이 없음을 확인한 후 사용하도록 한다.,,,,,,,,,,
C-35-2011,5.,5.1,,(6),,,,,위험기계․기구의 방호장치를 점검하고 이상이 있는 경우에는 정상적인 제품으로 교체하여야 한다.,,,,,,,,,,
C-35-2011,5.,5.1,,(7),,,,,관리감독자는 당해 작업의 위험요인과 이에 대한 안전수칙을 근로자에게 주지시키고 이행여부를 확인하여야 한다.,,,,,,,,,,
C-35-2011,5.,5.1,,(8),,,,,공사차량의 출입로를 확보하고 차량유도계획을 수립하여 제3자에게 피해를 주지않도록 하여야 한다.,,,,,,,,,,
C-35-2011,5.,5.1,,(9),,,,,"작업시작 전에 가설통로, 안전방망, 안전난간 등 안전시설의 설치상태를 확인하여야 한다.",,,,,,,,,,
C-35-2011,5.,5.1,,(10),,,,,"이동식 비계에 사용되는 부재의 재질 및 용접상태, 볼트 등의 이상유무를 사전에 확인하여야 한다.",,,,,,,,,,
C-35-2011,5.,5.1,,(11),,,,,작업장내 공구 및 자재를 정리 정돈하여 낙하․비래 등의 재해를 예방하여야 한다.,,,,,,,,,,
C-35-2011,5.,5.1,,(12),,,,,중량부재를 크레인으로 인양할 경우에는 부재에 인양용 러그(Lug)를 설치하여 사용하도록 한다.,,,,,,,,,,
C-35-2011,5.,5.1,,(13),,,,,중량물 부품을 운반하여 지면에 임시 적재할 때에는 반드시 받침목을 고이고 균형을 잡은 후 적재하여야 한다.,,,,,,,,,,
C-35-2011,5.,5.1,,(14),,,,,이동식 비계의 각 부재를 크레인으로 인양할 때에는 인양용 와이어로프를 부재의 2지점 이상에 결속하고 별도의 유도 로프를 설치하여 안전하게 유도하여야 한다.,,,,,,,,,,
C-35-2011,5.,5.1,,(15),,,,,강풍․강우 등 악천후 시에는 작업을 중지하여야 한다.,,,,,,,,,,
C-35-2011,5.,5.2,,,,,,설치작업,,,,,,,,,,,
C-35-2011,5.,5.2,5.2.1,,,,,교각 브라켓 및 이동대차,,,,,,,,,,,
C-35-2011,5.,5.2,5.2.1,(1),,,,,이동식 비계의 하중을 교각으로 전달하는 형태인 부착형 교각 브라켓을 설치할 때에는 브라켓 구조에 따라 교각에 고정할 수 있도록 홈을 설치하여야 한다.,,,,,,,,,,
C-35-2011,5.,5.2,5.2.1,(2),,,,,브라켓을 크레인 등으로 인양하여 교각에 설치할 때에는 고강도 강봉 등의 인장재로 교각에 견고하게 고정하여야 한다.,,,,,,,,,,
C-35-2011,5.,5.2,5.2.1,(3),,,,,브라켓의 측면 작업발판과 연결통로는 제작장에서 제작․설치되어야 한다.,,,,,,,,,,
C-35-2011,5.,5.2,5.2.1,(4),,,,,이동식 비계의 하중을 지주를 통하여 교각의 기초로 전달하는 형태인 지주형 교각 브라켓을 설치할 때에는 이동식 비계의 하중을 검토하여 안전하게 지지될 수 있도록 설치하여야 한다.,,,,,,,,,,
C-35-2011,5.,5.2,5.2.1,(5),,,,,지주형 브라켓은 교각의 양쪽에 설치하고 교각을 감싸는 형태로 보강재 또는 고강도 강봉 등의 인장재로 교각에 견고하게 고정하여야 한다.,,,,,,,,,,
C-35-2011,5.,5.2,5.2.1,(6),,,,,이동대차는 인양하여 교각 브라켓 상부의 레일 위에 차륜이 놓이도록 설치하고 이동대차가 불시에 이동하지 않도록 구름방지쐐기를 설치하는 등 안전조치를 하여야 한다.,,,,,,,,,,
C-35-2011,5.,5.2,5.2.1,(7),,,,,이동식 비계의 본체 및 유압시스템의 전동기 외함에는 접지를 하여야 한다.,,,,,,,,,,
C-35-2011,5.,5.2,5.2.1,(8),,,,,이동식 비계의 각 부재를 크레인으로 인양하여 공중에서 연결할 때에는 작업이 종료될 때까지 크레인에 부재를 확실하게 매달고 있어야 한다.,,,,,,,,,,
C-35-2011,5.,5.2,5.2.2,,,,,비계보 및 거푸집,,,,,,,,,,,
C-35-2011,5.,5.2,5.2.2,(1),,,,,지상에서 비계보의 각 분절(Segment)을 모두 연결하여 조립한 비계보를 설치할 때에는 전․후 교각의 이동대차 위에 안전하게 지지되도록 설치하여야 한다.,,,,,,,,,,
C-35-2011,5.,5.2,5.2.2,(2),,,,,비계보는 설치 즉시 이동을 방지하기 위하여 로프 등으로 교각에 결속하여야 한다.,,,,,,,,,,
C-35-2011,5.,5.2,5.2.2,(3),,,,,비계보를 설치하기 위하여 전․후방 교각 사이에 가 벤트(Bent)를 설치할 때에는 가 벤트에 작용하는 비계보 하중과 지반 지지력을 검토하여 안전한 구조로 설치하여야 한다.,,,,,,,,,,
C-35-2011,5.,5.2,5.2.2,(4),,,,,비계보 분절을 크레인으로 인양하여 공중에서 연결할 때에는 작업대(Cage)를 설치하여 작업하도록 하는 등 추락재해 예방조치를 하여야 한다.,,,,,,,,,,
C-35-2011,5.,5.2,5.2.2,(5),,,,,교대 후방의 지상에서 비계보 전체길이를 조립하여 이동․설치할 때에는 추진코 등 모든 부재를 조립하여 이동시킬 수 있도록 이동용 레일의 길이를 충분하게 설치하여야 한다.,,,,,,,,,,
C-35-2011,5.,5.2,5.2.2,(6),,,,,"비계보를 조립할 때에는 이동용 레일 위에 로울러를 설치한 다음 그 위에서 비계보를 조립하도록 하고, 이때 비계보 이동에 장애가 되지 않는 다른 부재도 함께 설치하도록 하여야 한다.",,,,,,,,,,
C-35-2011,5.,5.2,5.2.2,(7),,,,,비계보 조립 중에 로울러가 불시에 이동하지 않도록 각 로울러 앞․뒤에는 구름방지 조치를 하여야 한다.,,,,,,,,,,
C-35-2011,5.,5.2,5.2.2,(8),,,,,조립이 완료된 비계보는 윈치 또는 유압 실린더 등을 사용하여 교량 상부 구조물을 가설하여야 할 위치로 천천히 이동시켜야 한다.,,,,,,,,,,
C-35-2011,5.,5.2,5.2.2,(9),,,,,가로보 및 추진코를 크레인 등으로 인양하여 공중에서 비계보에 조립할 때 에는 작업대 등을 설치하여 추락재해를 예방하여야 한다.,,,,,,,,,,
C-35-2011,5.,5.2,5.2.2,(10),,,,,외부 거푸집 조립시에는 측면 거푸집의 작업발판 단부에 미리 지상에서 표준안전난간을 설치한 후 인양하여 조립하여야 한다.,,,,,,,,,,
C-35-2011,5.,5.2,5.2.2,(11),,,,,외부 거푸집을 크레인으로 인양하여 설치할 경우에는 신호수를 배치하고 하부의 근로자를 대피시킨 상태에서 하부의 지주 연결핀을 체결하여야 한다.,,,,,,,,,,
C-35-2011,5.,5.2,5.2.2,(12),,,,,후방 가로보를 설치하기 전에 설치장소의 콘크리트 강도 및 교량 상부 구조물의 강연선 인장작업 완료여부를 확인하여야 한다.,,,,,,,,,,
C-35-2011,5.,5.2,5.2.2,(13),,,,,교량 상부 슬래브 하부에 있는 비계보를 고강도의 강봉 등 현수재로 후방 가로보에 매다는 작업시에는 교량 상부 슬래브에 손상을 주지않도록 유의하여야 한다.,,,,,,,,,,
C-35-2011,5.,5.3,,,,,,이동작업,,,,,,,,,,,
C-35-2011,5.,5.3,,(1),,,,,"작업시작 전에 이동작업의 작업방법, 작업순서 및 안전조치 사항에 대하여 근로자에게 주지시켜야 한다.",,,,,,,,,,
C-35-2011,5.,5.3,,(2),,,,,최소 1주일 이상의 장기 일기예보를 파악하여 강풍․강우 등의 악천후가 없는 기간에 작업을 완료할 수 있도록 작업계획을 수립하여야 한다.,,,,,,,,,,
C-35-2011,5.,5.3,,(3),,,,,이동식 비계를 교량 상부구조물 가설높이에서 이동높이까지 내릴 때(약 100mm정도)에는 콘크리트 구조물이 파손되지 않도록 이동식 비계의 균형을 유지하여야 한다.,,,,,,,,,,
C-35-2011,5.,5.3,,(4),,,,,이동식 비계를 다음 작업 경간으로 이동할 때에는 이동작업 방법과 순서에 따라 천천히 이동시켜야 한다.,,,,,,,,,,
C-35-2011,5.,5.3,,(5),,,,,유압시스템 작동시 시스템 조작자와 각 브라켓의 유도원 사이에 신호체제를 유지하여 이동식 비계의 본체가 균형을 유지할 수 있도록 하여야 한다.,,,,,,,,,,
C-35-2011,5.,5.3,,(6),,,,,강풍이 예보되면 이동식 비계의 이동작업을 중지하고 강풍에 의하여 전도되지 않도록 비계보를 서로 결속하는 보강재를 설치한 후 교각에 견고히 고정하여야 한다.,,,,,,,,,,
C-35-2011,5.,5.3,,(7),,,,,이동대차의 슬라이딩 부분에는 그리스 주입 및 테프론 미끄럼판 안착상태를 확인하여야 한다.,,,,,,,,,,
C-35-2011,5.,5.3,,(8),,,,,이동식 비계를 추진하는 동안에는 교각 및 브라켓에 이동식 비계가 충돌하지 않도록 주의하여야 한다.,,,,,,,,,,
C-35-2011,5.,5.3,,(9),,,,,종단구배를 가진 공사구간에서 이동식 비계를 이동할 때에는 추진용유압 실린더가 비계보로부터 분리되어 있을 때 이동식 비계가 중력에 의하여 불시에 이동하지 않도록 이동식 비계의 본체를 항상 수평으로 유지․이동 시켜야 한다.,,,,,,,,,,
C-35-2011,5.,5.4,,,,,,해체작업,,,,,,,,,,,
C-35-2011,5.,5.4,,(1),,,,,"작업시작 전에 해체작업의 작업방법, 작업순서 및 안전조치 사항을 근로자에게 주지시켜야 한다.",,,,,,,,,,
C-35-2011,5.,5.4,,(2),,,,,해체작업순서는 설치순서의 역순으로 실시하여야 한다.,,,,,,,,,,
C-35-2011,5.,5.4,,(3),,,,,"후방 가로보, 추진코, 가로보 등의 부재를 해체할 때에는 크레인 등 인양기계에 매단 상태에서 부재를 연결하고 있는 연결핀 또는 볼트를 해체하여 완전히 분리시킨 후 지상으로 내려야 한다.",,,,,,,,,,
C-35-2011,5.,5.4,,(4),,,,,부재를 해체하여 지면으로 내릴 때에는 신호수를 배치하여 신호하고 해체 작업장 하부에는 근로자의 출입을 금지하여야 한다.,,,,,,,,,,
C-35-2011,5.,5.4,,(5),,,,,거푸집을 크레인으로 인양하여 지상으로 내릴 때에는 해체되지 않은 다른 부재와 충돌하지 않도록 유도용 로프를 설치하여 유도하여야 한다.,,,,,,,,,,
C-35-2011,5.,5.4,,(6),,,,,비계보에서 가로보 해체 시에는 가로보 하부에 부착된 작업발판 위에서 연결핀 또는 볼트를 제거하지 않도록 하여야 한다.,,,,,,,,,,
C-35-2011,5.,5.4,,(7),,,,,비계보 해체 시에는 비계보의 불시 이동을 방지하기 위하여 크레인에 비계보를 매단 상태에서 비계보와 이동대차를 연결하고 있는 추진용 유압 실린더를 해체하여야 한다.,,,,,,,,,,
C-35-2011,5.,5.4,,(8),,,,,비계보를 해체하기 위하여 전․후방 교각 사이에 가 벤트를 설치할 때에는 상부에 작용하는 비계보 하중과 지반 지지력을 검토하여 안전한 구조로 설치하여야 한다.,,,,,,,,,,
C-35-2011,5.,5.4,,(9),,,,,해체할 비계보를 지면으로 내리기 위하여 크레인으로 인양할 때에는 와이어로프를 비계보의 2지점 이상 결속하고 유도 로프를 설치하여 유도하여야 한다.,,,,,,,,,,
C-35-2011,5.,5.4,,(10),,,,,이동대차를 해체할 때에는 이동대차의 차륜 전․후에 구름방지장치를 설치하여 고정된 상태에서 이동대차와 브라켓을 연결하고 있는 유압 실린더를 해체하여야 한다.,,,,,,,,,,
C-35-2011,5.,5.4,,(11),,,,,"교각에 설치된 브라켓을 해체할 때에는 서로 결속하고 있는 인장재를 풀기 전에 브라켓을 와이어로프 등으로 교각 상부에 고정하거나, 크레인 등 인양기계에 매달고 있어야 한다.",,,,,,,,,,
C-35-2011,6.,,,,,,,부대 안전시설 설치기준,,,,,,,,,,,
C-35-2011,6.,6.1,,,,,,일반사항,,,,,,,,,,,
C-35-2011,6.,6.1,,(1),,,,,"이동식 비계에 설치하는 작업발판, 통로, 안전난간 등 안전시설은 고정형으로 설치하는 것을 원칙으로 한다.",,,,,,,,,,
C-35-2011,6.,6.1,,(2),,,,,"이동식 비계 제작공장에서 설치할 안전시설은 운반 및 보관하는 동안 손상되지 않도록 관리하고, 운반 시 손상을 방지하기 위하여 안전시설을 분리할 때에는 인양하여 설치하기 전에 지상에서 미리 부착하여야 한다.",,,,,,,,,,
C-35-2011,6.,6.1,,(3),,,,,추락 및 낙하․비래 재해예방을 위한 안전방망은 부재의 조립․해체 등 고소작 업을 시작하기 전에 고소작업장 하부 전체에 걸쳐 견실하게 설치하여야 한다.,,,,,,,,,,
C-35-2011,6.,6.2,,,,,,작업발판,비계에 설치할 고정형 작업발판은 <표 1>과 같다.,,<표 1>,,,,,,,,
C-35-2011,6.,6.3,,,,,,가설통로,비계에 설치할 고정형 가설통로는 <표 2>와 같다.,,<표 2>,,,,,,,,
C-35-2011,6.,6.4,,,,,,안전방망,"비계의 설치, 이동 및 해체작업시 추락 및 낙하․비래 위험이 있는 장소에 설치할 안전방망은 <표 3>과 같다.",,<표 3>,,,,,,,,
C-35-2011,6.,6.5,,,,,,안전난간,"비계의 설치, 이동 및 해체 작업시에 근로자가 추락할 위험이 있는 개구부와 작업발판의 단부에 설치할 안전난간은 <표 4>와 같다.",,<표 4>,,,,,,,,
C-92-2013,4.,,,,,,,SCW 공법의 시공순서,공법의 시공순서는 <그림 3>와 같다.,<그림 3>,,,,,,,,,
C-92-2013,5.,,,,,,,SCW 공법의 일반 안전조치 사항,,,,,,,,,,,
C-92-2013,5.,,,(1),,,,,근로자의 위험을 방지하기 위하여 사업주는 사전에 다음의 내용에 관련한 작업계획서의 작성 및 작업지휘자를 지정을 하여야 하며 해당 근로자에게 안전한 작업방법 및 순서를 교육하여야 한다.,,,,,,,,,,
C-92-2013,5.,,,(1),(가),,,,플랜트의 설치 위치,,,,,,,,,,
C-92-2013,5.,,,(1),(나),,,,시멘트 밀크의 공급 방법 및 경로,,,,,,,,,,
C-92-2013,5.,,,(1),(다),,,,차량계 하역운반기계 작업,,,,,,,,,,
C-92-2013,5.,,,(1),(라),,,,굴착면의 높이가 2미터 이상 지반의 굴착작업,,,,,,,,,,
C-92-2013,5.,,,(1),(마),,,,중량물의 취급작업,,,,,,,,,,
C-92-2013,5.,,,(1),(바),,,,"천공기, 항타기, 항발기 작업",,,,,,,,,,
C-92-2013,5.,,,(1),(사),,,,가설전기의 인입경로 및 용량,,,,,,,,,,
C-92-2013,5.,,,(2),,,,,단위공종별 작업을 시작하기 전에는 위험성평가를 실시하고 세부 단위작업별 허용 가능한 위험범위 이내가 되도록 작업방법을 개선한 후가 아니면 작업하지 않도록 하여야 한다.,,,,,,,,,,
C-92-2013,5.,,,(3),,,,,"시공계획서 및 작업계획서를 활용하여 필요 장소에 안전표지판, 경고등, 차단막 등 안전사고방지를 위한 안전시설물을 설치하여야 한다.",,,,,,,,,,
C-92-2013,5.,,,(4),,,,,"근로자의 안전을 위하여 보호구의 착용상태 감시, 악천후 시에는 작업의 중지, 관계근로자 이외의 자의 출입통제 등이 이루어져야 하며, 무너짐의 위험이 있다고 판단된 경우에는 즉시 근로자를 안전한 장소로 대피시켜야 한다.",,,,,,,,,,
C-92-2013,5.,,,(5),,,,,SCW 흙막이 공사 시 플랜트 설치 및 시멘트 밀크 제작과 관련하여 다음의 안전지침을 준수하여 관련재해가 일어나지 않도록 하여야 한다.,,,,,,,,,,
C-92-2013,5.,,,(5),(가),,,,"플랜트 등에 사용되는 가설 전기설비에 대해서는 가설 울타리 및 분전반을 설치하는 등 전기안전시설을 확보해야 하며 작업 중 피복손상으로 인한 감전, 인화폭발, 전기화재 등의 재해를 예방하기 위하여 노출 충전부의 방호, 근로자의 감전방지, 분전함의 시건장치 등의 방지대책을 수립해야 한다.",,,,,,,,,,
C-92-2013,5.,,,(5),(나),,,,"플랜트, 가설전기 분전반 등은 지반침하로 인하여 깔림의 위험이 없도록 바닥에 콘크리트를 타설하는 등의 조치를 하여야 한다.",,,,,,,,,,
C-92-2013,5.,,,(5),(다),,,,"물질안전보건자료(MSDS)를 파악하여 취급시 주의사항 등을 교육시켜야 하며, MSDS 대장을 근로자가 보기 쉬운 위치에 비치하여야 한다.",,,,,,,,,,
C-92-2013,5.,,,(6),,,,,SCW 흙막이 공사시 줄파기 작업과 관련하여 다음의 안전지침을 준수하여 관련재해가 일어나지 않도록 하여야 한다.,,,,,,,,,,
C-92-2013,5.,,,(6),(가),,,,"공사 착수 전에 본 공사 시행으로 인한 인접 제반 시설물의 피해가 없도록 안전대책을 수립함은 물론 이에 대한 현황을 면밀히 조사, 기록, 표시하여야 하며, 인접 제반 시설물의 소유주에게 확인, 주지시켜야 한다.",,,,,,,,,,
C-92-2013,5.,,,(6),(나),,,,"SCW 시공 위치에 상·하수도관, 통신케이블, 가스관, 고압케이블 등 지하 매설물이 설치되어 있는지의 여부를 관계기관의 지하매설물 현황도를 확인하고 줄파기를 통하여 매설물을 노출시켜야 하며, 필요시 이설 또는 보호조치를 하여야 한다.",,,,,,,,,,
C-92-2013,5.,,,(6),(다),,,,줄파기 작업 후에는 근로자의 넘어지거나 떨어짐을 방지하기 위하여 난간을 설치하는 등 안전시설을 하여야 한다.,,,,,,,,,,
C-92-2013,5.,,,(7),,,,,SCW 흙막이 공사시 장비와 관련하여 다음의 안전지침을 준수하여 관련재해가 일어나지 않도록 하여야 한다.,,,,,,,,,,
C-92-2013,5.,,,(7),(가),,,,"현장 여건과 진행 공종별 장비 수급계획을 수립하여 현장의 각종 장비의 뒤집힘, 깔림, 끼임 등의 재해를 방지하고 장비의 통로는 배수가 잘 되도록 조치하고 지반의 침하나 변형을 수시로 확인하여 필요시 지반을 보강 하여야 한다.(필요시 양질의 토사치환, 철판깔기, 콘크리트 포설 등의 조치를 하여야 한다.)",,,,,,,,,,
C-92-2013,5.,,,(7),(나),,,,"크레인, 천공장비 등 장비를 현장에 반입할 경우에는 해당 장비이력카드를 확인하여 관련 법령에 의한 정기검사 등 이력을 확인하고, 작업 시작 전에 권과방지장치, 브레이크, 클러치 및 운전장치의 기능 등을 점검하여야 한다.",,,,,,,,,,
C-92-2013,5.,,,(7),(다),,,,"지게차를 사용하여 자재를 실을 때에는 허용적재하중을 초과하여 적재하여서는 아니 되며, 무게중심을 확보하여 하물이 넘어지지 아니하도록 하여야 한다.",,,,,,,,,,
C-92-2013,5.,,,(7),(라),,,,"장비의 하역작업을 하는 때에는 평탄한 장소에서 수행하여야 하며 인양 장비의 넘어짐 등을 방지하기 위하여 견고한 지반조건을 갖추어야 한다. 지반침하가 우려되는 때에는 양질의 토사로 치환, 콘크리트를 타설하는 등 지반침하방지를 위한 안전조치를 하여야 한다. 장비를 반출하는 경우에도 동일하게 적용된다.",,,,,,,,,,
